<?xml version="1.0"?>
<timetabling xmlns:xsi="http://www.w3.org/2001/XMLSchema-instance" xsi:noNamespaceSchemaLocation="usp_timetabling_v0_1.xsd"
    name="ua_l3info_20s6_w12d5s8_e0r5t2g4_s44_dw" nrWeeks="12" daysPerWeek="5" slotsPerDay="8">
    <calendar>
        <startingYear>2021</startingYear>
        <weeks>
            <week>1</week>
            <week>2</week>
            <week>3</week>
            <week>4</week>
            <week>5</week>
            <week>6</week>
            <week>7</week>
            <week>8</week>
            <!-- semaine 9 : vacances-->
            <week>10</week>
            <week>11</week>
            <week>12</week>
            <week>13</week>
        </weeks>
        <weekDays>
            <weekDay>1</weekDay>
            <weekDay>2</weekDay>
            <weekDay>3</weekDay>
            <weekDay>4</weekDay>
            <weekDay>5</weekDay>
        </weekDays>
        <daySlotTimes duration="80">
            <daySlotTime>08:00:00</daySlotTime>
            <daySlotTime>09:30:00</daySlotTime>
            <daySlotTime>11:00:00</daySlotTime>
            <daySlotTime>12:30:00</daySlotTime>
            <daySlotTime>14:00:00</daySlotTime>
            <daySlotTime>15:30:00</daySlotTime>
            <daySlotTime>17:00:00</daySlotTime>
            <daySlotTime>18:30:00</daySlotTime>
        </daySlotTimes>
    </calendar>

    <!-- pas d'équipements déclarés -->
 
    <!-- une salle, réelle ou virtuelle, ne peut accueillir qu'une séance par créneau -->
    <!-- les plages de fermeture des salles se formulent par contraintes -->
    <!-- les profils de salles à capacité variable se formulent par contraintes -->
    <rooms>
	    <!-- `capacity` : capacité d'accueil maximum d'une salle en nombre d'étudiants -->
	        <!-- `capacity>=-1` -->
	        <!-- `capacity==1` : capacité illimitée -->
	    <!-- `label` (optionnel) : étiquette ou liste d'étiquettes quelconques pour une salle -->
	    <room id="AMPHI-A" capacity="90" label="BATIMENT-A"/>
	    <room id="AMPHI-B" capacity="286" label="BATIMENT-A"/>
	    <room id="H001" capacity="20" label="BATIMENT-H"/>
	    <room id="H002" capacity="42" label="BATIMENT-H"/>
	    <room id="H003" capacity="38" label="BATIMENT-H"/>
    </rooms>

    <!-- un enseignant ne peut dispenser qu'une séance par créneau -->
    <!-- les plages d'absences des enseignants se formulent par contraintes -->
    <teachers>
        <!-- `label` (optionnel) : étiquette ou liste d'étiquettes quelconques pour un enseignant -->
        <teacher id="LESAINT David" label="DEPARTEMENT-INFORMATIQUE"/>
        <teacher id="JAMIN Antoine" label="DEPARTEMENT-INFORMATIQUE"/>
    </teachers>

    <!-- un groupe ne peut assister qu'à une séance par créneau -->
    <!-- codification des options : (i = Images de synthèse, p = traitement de données en Python, q = Qt, s = Systèmes intelligents) -->
    <!-- les plages d'indisponibilité des groupes se formulent par contraintes -->
    <groups>
        <!-- `size` : nombre d'étudiants d'un groupe -->
            <!-- `size>=1` -->
        <!-- `label` (optionnel) : étiquette ou liste d'étiquettes quelconques pour un groupe -->
        <group id="1-td1-tp1-pq" size="18" label="L3-INFORMATIQUE,TD1,TP1" />
        <group id="2-td1-tp3-ps" size="22" label="L3-INFORMATIQUE,TD1,TP3" />
        <group id="3-td2-tp2-is" size="10" label="L3-INFORMATIQUE,TD2,TP2" />
        <group id="4-td2-tp2-qs" size="17" label="L3-INFORMATIQUE,TD2,TP2" />
    </groups>

    <courses>
        <!-- `label` (optionnel) : étiquette ou liste d'étiquettes quelconques pour un cours -->
        <course id="Développement-Web" label="L3-INFORMATIQUE,UE">
            <!-- les parties du cours -->
            <!-- au moins une partie par cours -->
            <!-- chaque partie comprend un ensemble de classes et prescrit un ensemble de ressources requises et possibles -->
            <!-- `nrSessions` : nombre de séances à dispenser pour chacune des classes de la partie -->
                <!-- `nrSessions>=1` -->
                <!-- chaque séance de classe est implicitement identifiée par un entier dans la plage `1..nrSessions` -->
            <!-- `sessionLength` : durée de chaque séance en nombre de créneaux consécutifs -->
            <!-- `sessionRooms` : mode de sélection d'une salle par session -->
            	<!-- `none` : pas de salle -->
            	<!-- `single` : une seule salle par session, toute la classe doit tenir dans la salle -->
            	<!-- `multiple` : autant de salles que nécessaire : les groupes d'une même classe pourront être dans des salles différentes -->
            <!-- `sessionTeachers` : nombre d'enseignants différents par séance -->
                <!-- `length>=1` -->
            <!-- `label` (optionnel) : étiquette ou liste d'étiquettes quelconques pour une partie -->
            <part id="Développement-Web-CM" nrSessions="12" sessionLength="1" label="CM">
                <!-- les classes de la partie et leurs groupes -->
                <!-- au moins une classe par partie, au moins un groupe par classe -->
                <!-- les classes de la partie partitionnent l'ensemble des groupes listés dans la partie -->
                <!-- les séances d'une classe sont chacune dispensées à tous les groupes de la classe -->
                <!-- les contraintes de programmation de séances se formulent par contraintes -->
                <classes>
                    <class id="Développement-Web-CM1">
                        <group refId="1-td1-tp1-pq" />
                        <group refId="2-td1-tp3-ps" />
                        <group refId="3-td2-tp2-is" />
                        <group refId="4-td2-tp2-qs" />
                    </class>
                </classes>

                <!-- pas d'équipements requis -->

                <!-- le pool de salles possibles ou requises pour toutes les classes -->
                <!-- la politique d'allocation de salles aux classes ou aux séances de classes se formule par contraintes -->
                    <!-- par exemple, placement d'une classe particulière dans une salle particulière -->
                    <!-- par exemple, placement des séances d'une classe dans la (les) même(s) salle(s) -->
                <allowedRooms sessionRooms="single">
                    <!-- `mandatory` (true|false) : (défaut: false) la salle doit-elle être utilisée obligatoirement -->
                    <room refId="AMPHI-A" />
                    <room refId="AMPHI-B" />
                </allowedRooms>

                <!-- le pool d'enseignants possibles ou requis pour les classes -->
                <!-- la politique d'attribution des classes ou séances de classes aux enseignants se formule par contraintes -->
                    <!-- par exemple, attribution d'une classe particulière à un enseignant particulier -->
                    <!-- par exemple, attribution des séances d'une classe au(x) même(s) enseignant(s) -->
                <allowedTeachers sessionTeachers="1">
                    <teacher refId="LESAINT David" nrSessions="12" />
                </allowedTeachers>
            </part>
 
            <part id="Développement-Web-TP" nrSessions="8" sessionLength="2" label="TP">
                <classes>
                    <class id="Développement-Web-TP1">
                        <group refId="1-td1-tp1-pq" />
                    </class>
                    <class id="Développement-Web-TP2">
                        <group refId="3-td2-tp2-is" />
                        <group refId="4-td2-tp2-qs" />
                    </class>
                    <class id="Développement-Web-TP3">
                        <group refId="2-td1-tp3-ps" />
                    </class>
                </classes>                
                
                <allowedRooms sessionRooms="single">
                    <room refId="H001" />
                    <room refId="H002" />
                    <room refId="H003" />
                </allowedRooms>
                
                <allowedTeachers sessionTeachers="1">
                    <teacher refId="LESAINT David" nrSessions="12" />
                    <teacher refId="JAMIN Antoine" nrSessions="12" />
                </allowedTeachers>
            </part>

            <part id="Développement-Web-PR" nrSessions="8" sessionLength="3" label="PR">
                <classes>
                    <class id="Développement-Web-PR1">
                        <group refId="1-td1-tp1-pq" />
                        <group refId="3-td2-tp2-is" />
                        <group refId="4-td2-tp2-qs" />
                        <group refId="2-td1-tp3-ps" />
                    </class>
                </classes>
                <allowedRooms sessionRooms="multiple">
                    <room refId="H001" />
                    <room refId="H002" />
                    <room refId="H003" />
                </allowedRooms>
                <!-- Pas d'enseignant pour les projets -->
            </part>
        </course>
    </courses>
    
    <constraints>
        <!-- les séances d'une classe du cours Développement-Web sont séquencées dans l'ordre conventionnel -->
        <constraintCollection>
            <!-- chaque portée regroupe les séances d'une classe du cours ciblé selon l'ordre conventionnel de leurs indices -->
            <sessions groupBy="class">
                <filter type="course" attributeName="id" in="Développement-Web"/>
            </sessions>
            <!-- chaque contrainte est dure -->
            <!-- le prédicat `sequenced` impose le séquencement (sans chevauchement) des séances qui se suivent dans sa portée -->
            <constraint name="sequenced" type="hard">
            </constraint> 
        </constraintCollection>

        <!-- les séances d'une classe de la partie Développement-Web-CM, à l'exclusion des séances 2 et 3, sont hebdomadaires et programmées sur le même créneau -->
        <constraintCollection>